{
  "eventId": "b0000000-0000-4000-8000-000000000002",
  "eventType": "order.status.changed",
  "version": 1,
  "occurredAt": "2026-09-18T12:00:00Z",
  "traceId": "4bf92f3577b34da6a3ce929d0e0e4736",
  "orderId": "c0000000-0000-4000-8000-000000000001",
  "payload": {
    "previousStatus": "PENDENTE",
    "status": "CONFIRMADO",
    "author": {
      "userId": "80000000-0000-4000-8000-000000000001",
      "role": "OPERACAO"
    },
    "reason": "Pagamento aprovado."
  }
}
